{
  "$schema": "https://json-schema.org/draft/2020-12/schema",
  "$id": "https://caseware.invalid/docs/en/data/dynamo/schemas/ms-publish-fanout/fanout_task.schema.json",
  "title": "fanout_task item (FanOutTask)",
  "description": "One task (jobId, engagementId) against the ~1 min downstream (DISENO S4 (b)(c); FW-002). States are those of the Part 2 worker (PENDING, IN_PROGRESS, DONE, FAILED, OBSOLETE; DEC-30).",
  "$comment": "Table fanout_task (per cell). PK = TASK#<jobId>#<engagementId>, SK = TASK. Sparse GSI1 (ready tasks): GSI1PK = RDY#<priority>#<firmId>#B<0..B_rdy-1>, GSI1SK = <createdAt>#<engagementId>, only while PENDING. Sparse GSI2 (leases): GSI2PK = LEASE#B<0..B_lease-1>, GSI2SK = <leaseUntil>, only while IN_PROGRESS. Sparse GSI3 (failed): GSI3PK = FAILED#<jobId>, GSI3SK = <engagementId>, only while FAILED. AP-F1 PutItem attribute_not_exists; AP-F3 Query GSI1 in creation order; AP-F4 conditional claim (state = PENDING OR (state = IN_PROGRESS AND leaseUntil < :now)); AP-F5 Query GSI2 SK < now; AP-F8 Query GSI3 and FAILED -> PENDING. Retries happen in the worker thread with backoff (no separate retry state). Downstream idempotencyKey = jobId:engagementId:targetVersion (NONE without target). TTL ttl = TTL_job when finished. Streams NEW_AND_OLD_IMAGES -> EngagementVersionInspected.v1 (-> DONE), FanOutTaskDeadLettered.v1 (-> FAILED) (DEC-06).",
  "type": "object",
  "properties": {
    "PK": {
      "type": "string",
      "description": "Partition key. PK = \"TASK#<jobId>#<engagementId>\".",
      "pattern": "^TASK#[0-9a-f]{8}-[0-9a-f]{4}-[0-9a-f]{4}-[0-9a-f]{4}-[0-9a-f]{12}#[0-9a-f]{8}-[0-9a-f]{4}-[0-9a-f]{4}-[0-9a-f]{4}-[0-9a-f]{12}$"
    },
    "SK": {
      "type": "string",
      "description": "Sort key. SK = \"TASK\".",
      "const": "TASK"
    },
    "GSI1PK": {
      "type": "string",
      "description": "GSI1 (ready) partition key. GSI1PK = \"RDY#<priority>#<firmId>#B<bucket>\", bucket in 0..B_rdy-1.",
      "pattern": "^RDY#(INTERACTIVE|PUBLISH|BACKFILL|RECONCILIATION)#[0-9a-f]{8}-[0-9a-f]{4}-[0-9a-f]{4}-[0-9a-f]{4}-[0-9a-f]{12}#B[0-9]+$"
    },
    "GSI1SK": {
      "type": "string",
      "pattern": "^[0-9]{4}-[0-9]{2}-[0-9]{2}T[^#]+#[0-9a-f]{8}-[0-9a-f]{4}-[0-9a-f]{4}-[0-9a-f]{4}-[0-9a-f]{12}$",
      "description": "GSI1 (ready) sort key. GSI1SK = \"<createdAt>#<engagementId>\" (creation order within the firm)."
    },
    "GSI2PK": {
      "type": "string",
      "description": "GSI2 (leases) partition key. GSI2PK = \"LEASE#B<bucket>\", bucket in 0..B_lease-1.",
      "pattern": "^LEASE#B[0-9]+$"
    },
    "GSI2SK": {
      "type": "string",
      "description": "GSI2 (leases) sort key. GSI2SK = \"<leaseUntil>\"."
    },
    "GSI3PK": {
      "type": "string",
      "pattern": "^FAILED#[0-9a-f]{8}-[0-9a-f]{4}-[0-9a-f]{4}-[0-9a-f]{4}-[0-9a-f]{12}$",
      "description": "GSI3 (failed) partition key. GSI3PK = \"FAILED#<jobId>\"."
    },
    "GSI3SK": {
      "type": "string",
      "pattern": "^[0-9a-f]{8}-[0-9a-f]{4}-[0-9a-f]{4}-[0-9a-f]{4}-[0-9a-f]{12}$",
      "description": "GSI3 (failed) sort key. GSI3SK = \"<engagementId>\"."
    },
    "entityType": {
      "type": "string",
      "const": "FanOutTask",
      "description": "Discriminator of the item type (technical)."
    },
    "jobId": {
      "type": "string",
      "format": "uuid",
      "description": "Job id."
    },
    "engagementId": {
      "type": "string",
      "format": "uuid",
      "description": "Engagement id."
    },
    "firmId": {
      "type": "string",
      "format": "uuid",
      "description": "Firm id (fairness, FW-013)."
    },
    "priority": {
      "type": "string",
      "enum": [
        "INTERACTIVE",
        "PUBLISH",
        "BACKFILL",
        "RECONCILIATION"
      ],
      "description": "PriorityClass (DISENO S4 (b))."
    },
    "targetVersion": {
      "type": "string",
      "minLength": 1,
      "description": "Target version label of the job; NONE in jobs without target (backfill, reconciliation, interactive). Part of the downstream idempotencyKey."
    },
    "attempts": {
      "type": "integer",
      "description": "Attempts counted before each call (Part 2 beginAttempt); reset to 0 on a retry of FAILED tasks."
    },
    "leaseOwner": {
      "type": "string",
      "format": "uuid",
      "description": "Worker instance holding the lease (uuid, DISENO 3.8.1)."
    },
    "leaseUntil": {
      "type": "string",
      "format": "date-time",
      "description": "Lease expiry (T_call + margin, heartbeat T_hb)."
    },
    "lastError": {
      "type": "string",
      "description": "Last error code/message (no confidential content)."
    },
    "failureReason": {
      "type": "string",
      "enum": [
        "RETRIES_EXHAUSTED",
        "NON_RETRYABLE"
      ],
      "description": "Why the task is FAILED (Part 2 FailureReason; reasonCode of EV-25)."
    },
    "obsoleteReason": {
      "type": "string",
      "enum": [
        "SUPERSEDED",
        "CANCELLED"
      ],
      "description": "Why the task is OBSOLETE: newer publication of the same template, or job cancellation / version withdrawal."
    },
    "ttl": {
      "type": "integer",
      "description": "DynamoDB TTL attribute, epoch seconds. Duration = named parameter TTL_job (no value fixed in the docs). Set when the task reaches a terminal state."
    },
    "version": {
      "type": "integer",
      "description": "Optimistic-concurrency attribute (CLAUDE.md DynamoDB rules; RF-067): every write is conditional on the previous value and increments it."
    },
    "createdBy": {
      "type": "string",
      "format": "uuid",
      "description": "Audit (technical, mandatory): principal id that created the item; system writers use the service-principal uuid configured per service."
    },
    "createdAt": {
      "type": "string",
      "format": "date-time",
      "description": "Audit (technical, mandatory): creation instant (ISO-8601 UTC)."
    },
    "updatedBy": {
      "type": "string",
      "format": "uuid",
      "description": "Audit (technical, mandatory): principal id of the last write; changes on every write."
    },
    "updatedAt": {
      "type": "string",
      "format": "date-time",
      "description": "Audit (technical, mandatory): instant of the last write; changes on every write."
    },
    "state": {
      "type": "string",
      "enum": [
        "PENDING",
        "IN_PROGRESS",
        "DONE",
        "FAILED",
        "OBSOLETE"
      ],
      "description": "Part 2 states (DISENO_FANOUT_WORKER.md 1.5): PENDING -> IN_PROGRESS (claim with lease) -> DONE | FAILED | PENDING (graceful shutdown); PENDING or own IN_PROGRESS -> OBSOLETE; FAILED -> PENDING only by the operator/CMD-06 retry. Lifecycle and who sets it: DISENO 3.8.2 (DEC-27)."
    }
  },
  "required": [
    "PK",
    "SK",
    "entityType",
    "jobId",
    "engagementId",
    "firmId",
    "priority",
    "attempts",
    "version",
    "createdBy",
    "createdAt",
    "updatedBy",
    "updatedAt",
    "state",
    "targetVersion"
  ],
  "additionalProperties": false,
  "allOf": [
    {
      "if": {
        "properties": {
          "state": {
            "const": "PENDING"
          }
        },
        "required": [
          "state"
        ]
      },
      "then": {
        "required": [
          "GSI1PK",
          "GSI1SK"
        ]
      }
    },
    {
      "if": {
        "properties": {
          "state": {
            "const": "IN_PROGRESS"
          }
        },
        "required": [
          "state"
        ]
      },
      "then": {
        "required": [
          "GSI2PK",
          "GSI2SK",
          "leaseOwner",
          "leaseUntil"
        ]
      }
    },
    {
      "if": {
        "properties": {
          "state": {
            "const": "FAILED"
          }
        },
        "required": [
          "state"
        ]
      },
      "then": {
        "required": [
          "GSI3PK",
          "GSI3SK",
          "failureReason"
        ]
      }
    },
    {
      "if": {
        "properties": {
          "state": {
            "const": "OBSOLETE"
          }
        },
        "required": [
          "state"
        ]
      },
      "then": {
        "required": [
          "obsoleteReason"
        ]
      }
    }
  ]
}
