{
  "PK": "TASK#66666666-6666-4666-8666-666666666666#11111111-1111-4111-8111-111111111111",
  "SK": "TASK",
  "GSI2PK": "LEASE#B2",
  "GSI2SK": "2026-10-22T10:01:35Z",
  "entityType": "FanOutTask",
  "jobId": "66666666-6666-4666-8666-666666666666",
  "engagementId": "11111111-1111-4111-8111-111111111111",
  "firmId": "22222222-2222-4222-8222-222222222222",
  "priority": "PUBLISH",
  "targetVersion": "v7",
  "attempts": 1,
  "leaseOwner": "99999999-9999-4999-8999-999999999999",
  "leaseUntil": "2026-10-22T10:01:35Z",
  "version": 2,
  "createdBy": "00000000-0000-4000-8000-000000000001",
  "createdAt": "2026-10-22T10:00:00Z",
  "updatedBy": "00000000-0000-4000-8000-000000000001",
  "updatedAt": "2026-10-22T10:00:05Z",
  "state": "IN_PROGRESS"
}
